{
    "$schema": "https://raw.githubusercontent.com/avict1809/vylos-ide/main/docs/extensions/schemas/course.schema.json",
    "id": "python-first-steps",
    "title": "Python First Steps",
    "tagline": "Your first hour of Python: run code, store values, make decisions.",
    "level": "Beginner",
    "hours": 1,
    "accent": "#3776AB",
    "badge": "PY",
    "category": "language",
    "stack": "Python",
    "requires": ["python"],
    "tutorGuidelines": [
        "Assume the learner has never programmed before. Explain every new word the first time you use it.",
        "Keep every example under 10 lines and run it after writing it."
    ],
    "modules": [
        {
            "title": "Running Python",
            "description": "Write a line of Python, run it, and read what it prints.",
            "lessons": [
                "What a program is",
                "Printing text with print()",
                { "id": "running-a-script", "title": "Running a .py file from the terminal" }
            ]
        },
        {
            "title": "Values and Decisions",
            "description": "Keep values in variables and let the program choose what to do.",
            "lessons": [
                "Variables: giving a value a name",
                "Numbers and strings",
                {
                    "title": "Asking a question with if / else",
                    "exercise": {
                        "prompt": "Finish the program: it asks for an age, then prints `Adult` for 18 and over, and `Minor` otherwise.",
                        "files": {
                            "age.py": "age = int(input(\"How old are you? \"))\n# Print Adult for 18 and over, otherwise Minor\n"
                        },
                        "check": {
                            "type": "output",
                            "cases": [
                                { "name": "20 is an adult", "input": "20", "expected": "Adult", "match": "contains" },
                                { "name": "18 is an adult", "input": "18", "expected": "Adult", "match": "contains" },
                                { "name": "12 is a minor", "input": "12", "expected": "Minor", "match": "contains" }
                            ]
                        },
                        "hints": [
                            "`if age >= 18:` runs the indented lines under it only when the condition is true.",
                            "`else:` catches every other case. Both lines under them need the same indentation."
                        ],
                        "solution": "age = int(input(\"How old are you? \"))\nif age >= 18:\n    print(\"Adult\")\nelse:\n    print(\"Minor\")\n"
                    }
                }
            ]
        }
    ]
}
